{
  "date": "2023-03-08",
  "doctor": {
    "firstName": "Olivia",
    "lastName": "Jones",
    "qualifications": "MBBS",
    "registrationNumber": "123456"
  },
  "medication": {
    "dosage": "500mg",
    "duration": "7 days",
    "frequency": "twice a day",
    "name": "Paracetamol",
    "units": "tablets"
  },
  "notes": "Patient has a history of headaches.",
  "patient": {
    "dateOfBirth": "1990-01-01",
    "firstName": "Aiden",
    "gender": "male",
    "lastName": "Smith",
    "medicareNumber": "1234567890"
  }
}
